sub_industry,Industry,sector,sic_code,sic_description
Property Maintenance & Repairs,Specialized Consumer Services,Consumer Goods & Services,81100,Combined facilities support activities
Property Renovation/Remodeling,Construction & Engineering,Construction & Materials,43999,Other specialised construction activities n.e.c.
Property Shops,Property Rental & Real Estate Services,Real Estate,68310,Real estate agencies
Property Tax,Financial Services,Professional Services,69203,Tax consultancy
Value Added Sea Foods,Food & Beverage Industry,Manufacturing & Industrials,10200,"Processing and preserving of fish, crustaceans and molluscs"
Psychiatrists,Health Care Providers & Services,Healthcare,86220,Specialists medical practice activities
Psychoanalysts,Health Care Providers & Services,Healthcare,86900,Other human health activities
Psychology,Health Care Providers & Services,Healthcare,86220,Specialists medical practice activities
Psychosomatic Medical Practitioner,Health Care Providers & Services,Healthcare,86220,Specialists medical practice activities
Psychotherapists,Health Care Providers & Services,Healthcare,86900,Other human health activities
Pub Company,"Pubs, Bars & Inns",Hospitality,56302,Public houses and bars
Pub Food,"Hotels, Restaurants & Leisure",Hospitality,56302,Public houses and bars
Public Analysts,Professional & Commercial Services,Professional Services,71200,Technical testing and analysis
Public Health,Health Care Providers & Services,Healthcare,84120,"Regulation of health care, education, cultural and other social services, not incl. social security"
Public House Management,"Pubs, Bars & Inns",Hospitality,56302,Public houses and bars
Public Parking Space,Logistics & Transportation,Transportation & Logistics,52219,"Other service activities incidental to land transportation, n.e.c."
Public Policy,Public Policy Offices,Public Sector & Government,84120,"Regulation of health care, education, cultural and other social services, not incl. social security"
Public Relations,Professional & Commercial Services,Professional Services,70210,Public relations and communications activities
Public Relations Consultants Software & Services,Professional & Commercial Services,Professional Services,70210,Public relations and communications activities
Public Relations Firms/Consultants,Professional & Commercial Services,Professional Services,70210,Public relations and communications activities
Public Sector Procurement,Public Sector & Government,Public Sector & Government,84130,Regulation of and contribution to more efficient operation of businesses
Public Swimming Pools,Travel & Leisure,Hospitality,93110,Operation of sports facilities
Public Works Contractors,Construction & Engineering,Construction & Materials,42990,Construction of other civil engineering projects n.e.c.
Publishers,Publishing,"Media, Publishing & Entertainment",58110,Book publishing
Publishers' Services,Publishing,"Media, Publishing & Entertainment",58190,Other publishing activities
"Pubs, Bars & Inns",Hospitality Management & Services,Hospitality,56302,Public houses and bars
Pump Manufacturers,Industrial Equipment & Supplies,Manufacturing & Industrials,28131,Manufacture of pumps
Pump Repair Sales & Service,Industrial Equipment & Supplies,Manufacturing & Industrials,33190,Repair of other equipment
Pumps and Blasters,Industrial Equipment & Supplies,Manufacturing & Industrials,28131,Manufacture of pumps
Puppy Training,Pet Services & Supplies,Consumer Goods & Services,96090,Other service activities n.e.c.
Purchasing,Inventory & Supply Chain Management,Professional Services,70229,Management consultancy activities other than financial management
Purchasing Services,Inventory & Supply Chain Management,Professional Services,70229,Management consultancy activities other than financial management
Purebred Andalusian Breeding,Animal Breeding,Agriculture & Farming,01430,Raising of horses and other equines
Purified Water System,Water Engineering,Manufacturing & Industrials,36000,"Water collection, treatment and supply"
PVC Products Manufacturers & Suppliers,Plastics Manufacturing,Manufacturing & Industrials,22290,Manufacture of other plastic products
Quality Consultants,Consulting Services,Professional Services,70229,Management consultancy activities other than financial management
Quality Furniture Retailer,Furniture,Retail,47599,"Retail of furniture, lighting, and similar (not musical instruments or scores) in specialised store"
Quality Procedures Processes & Assessment,Consulting Services,Professional Services,70229,Management consultancy activities other than financial management
Quantity Surveyors,Surveying Services,Professional Services,74902,Quantity surveying activities
Quarries,Materials & Metals,Construction & Materials,08110,"Quarrying of ornamental and building stone, limestone, gypsum, chalk and slate"
Rabbit Breeders,Animal Breeding,Agriculture & Farming,01490,Raising of other animals
Racecourses & Tracks,Travel & Leisure,Hospitality,93110,Operation of sports facilities
Racking Systems,Material Handling Equipment & Systems,Manufacturing & Industrials,52103,Operation of warehousing and storage facilities for land transport activities
Radiator Covers,Mechanical Engineering,Manufacturing & Industrials,31090,Manufacture of other furniture
Radiators,Mechanical Engineering,Manufacturing & Industrials,25210,Manufacture of central heating radiators and boilers
Radio & Television Stations,Broadcasting,"Media, Publishing & Entertainment",60100,Radio broadcasting
Radio Broadcaster,Broadcasting,"Media, Publishing & Entertainment",60100,Radio broadcasting
Radio Communication Equipment,Communication Services & Equipment,Manufacturing & Industrials,26309,"Manufacture of communication equipment other than telegraph, and telephone apparatus and equipment"
Radio Telephone Services,Telecommunication Services & Engineering,Telecommunications,61200,Wireless telecommunications activities
Radiographic Services,Laboratory Services,Healthcare,86900,Other human health activities
Radon Gas Detection & Services,Environmental Engineering & Services,Manufacturing & Industrials,71200,Technical testing and analysis
Wet Soups,Food & Beverage Industry,Manufacturing & Industrials,10850,Manufacture of prepared meals and dishes
Rail & Road Haulage Services,Logistics & Transportation,Transportation & Logistics,49410,Freight transport by road
Rail Transport Services,Rail Transportation,Transportation & Logistics,49200,Freight rail transport
Railing Contract,Construction & Engineering,Construction & Materials,43390,Other building completion and finishing
Railings & Guard Rails,Metal Fabrication,Manufacturing & Industrials,25110,Manufacture of metal structures and parts of structures
Railroads,Rail Transportation,Transportation & Logistics,49100,"Passenger rail transport, interurban"
Railway Equipment Manufacturers,Logistics & Transportation,Manufacturing & Industrials,30200,Manufacture of railway locomotives and rolling stock
Railway Sleepers,Machinery & Manufacturing Services,Manufacturing & Industrials,16210,Manufacture of veneer sheets and wood-based panels
Railways,Rail Transportation,Transportation & Logistics,49100,"Passenger rail transport, interurban"
Rainwater Harvesting,Environmental Engineering & Services,Manufacturing & Industrials,36000,"Water collection, treatment and supply"
Ramp,Construction & Engineering,Construction & Materials,43390,Other building completion and finishing
Wine Making & Home Brewing Equipment & Supplies,Food & Beverage Industry,Manufacturing & Industrials,46690,Wholesale of other machinery and equipment
Rare & Vintage Books,Books & Media,"Media, Publishing & Entertainment",47791,Retail sale of antiques including antique books in stores
Garden Ornament Manufacturers,Garden Supplies,Manufacturing & Industrials,23490,Manufacture of other ceramic products n.e.c.
Ready To Drink Sweet Tea,Beverage Manufacturing,Consumer Goods & Services,11070,Manufacture of soft drinks; production of mineral waters and other bottled waters
Real Ales,Beverage Manufacturing,Consumer Goods & Services,11050,Manufacture of beer
"Real Estate Agencies, Agents, Buyers",Property Rental & Real Estate Services,Real Estate,68310,Real estate agencies
Real Estate Management & Development,Property Rental & Real Estate Services,Real Estate,68320,Management of real estate on a fee or contract basis
Receptions,Events Management,Professional Services,56210,Event catering activities
Recipes,Food Delivery & Service,Hospitality,58110,Book publishing
Reclamation Centres,Recycling & Waste Management,Manufacturing & Industrials,38110,Collection of non-hazardous waste
Record Companies,Music Industry,"Media, Publishing & Entertainment",59200,Sound recording and music publishing activities
"Record, Tape & CD Manufacturers And Wholesalers",Media Production & Services,"Media, Publishing & Entertainment",18201,Reproduction of sound recording
Recording Equipment,Music Equipment,Consumer Goods & Services,26400,Manufacture of consumer electronics
Recording/Rehearsal Studios & Facilities,Media Production & Services,"Media, Publishing & Entertainment",59200,Sound recording and music publishing activities
Records Management,Records Management,Professional Services,82110,Combined office administrative service activities
Recruiter,Human Resources & Employment Services,Professional Services,78109,Other activities of employment placement agencies
Recruitment,Human Resources & Employment Services,Professional Services,78109,Other activities of employment placement agencies
Recycling & Disposal,Recycling & Waste Management,Manufacturing & Industrials,38320,Recovery of sorted materials
Recycling And Disposal Tires,Recycling & Waste Management,Manufacturing & Industrials,38320,Recovery of sorted materials
Recycling And Disposing Of Oils,Recycling & Waste Management,Manufacturing & Industrials,38320,Recovery of sorted materials
Recycling Centres,Recycling & Waste Management,Manufacturing & Industrials,38320,Recovery of sorted materials
Reduction Club,Personal Care & Services,Consumer Goods & Services,93130,Fitness facilities
Reefer Containers,Logistics & Transportation,Transportation & Logistics,52103,Operation of warehousing and storage facilities for land transport activities
Reflexologist,Health Care Providers & Services,Healthcare,86900,Other human health activities
Refractory Materials & Supplies,Building Materials & Products,Manufacturing & Industrials,46900,Non-specialised wholesale trade
Refrigerants,Chemical Products & Chemicals,Construction & Materials,20130,Manufacture of other inorganic basic chemicals
Refrigerated Cabinets,Machinery & Manufacturing Services,Manufacturing & Industrials,28250,Manufacture of non-domestic cooling and ventilation equipment
Refrigerated Containers,Logistics & Transportation,Transportation & Logistics,52103,Operation of warehousing and storage facilities for land transport activities
Refrigerated Groupage Distribution,Logistics & Transportation,Transportation & Logistics,53201,Licensed carriers
Refrigeration Equipment - Commercial,Industrial Equipment & Supplies,Manufacturing & Industrials,46690,Wholesale of other machinery and equipment
Refrigeration Equipment Manufacturers & Distributors,Machinery & Manufacturing Services,Manufacturing & Industrials,28250,Manufacture of non-domestic cooling and ventilation equipment
Refrigerator Repair Services,Specialized Consumer Services,Consumer Goods & Services,95220,Repair of household appliances and home and garden equipment
Refrigerators & Freezers,Household Goods & Services,Manufacturing & Industrials,27510,Manufacture of electric domestic appliances
Refugee Hearings,Public Sector & Government,Public Sector & Government,84230,Justice and judicial activities
Refuse Disposal Equipment,Recycling & Waste Management,Manufacturing & Industrials,28990,Manufacture of other special-purpose machinery n.e.c.
Regenerative Medicine,Health Care Providers & Services,Healthcare,86900,Other human health activities
Registered Gas Installer,Construction Services,Construction & Materials,43220,"Plumbing, heat and air-conditioning installation"
Relaxation Techniques,Health Care Providers & Services,Healthcare,86900,Other human health activities
Religious Furnishings & Supplies,Civic & Social Organizations,Public Sector & Government,94910,Activities of religious organisations
Religious Organizations,Civic & Social Organizations,Public Sector & Government,94910,Activities of religious organisations
Religious Places/Place Of Worship,Civic & Social Organizations,Public Sector & Government,94910,Activities of religious organisations
Relocation Services,Professional & Commercial Services,Professional Services,49420,Removal services
Remanufactured,Machinery & Manufacturing Services,Manufacturing & Industrials,33190,Repair of other equipment
Remapping,Automotive Services,Automotive,45200,Maintenance and repair of motor vehicles
Remediation,Environmental Engineering & Services,Manufacturing & Industrials,39000,Remediation activities and other waste management services
Remote Life Support,Medical Devices & Services,Healthcare,86900,Other human health activities
Removalists Melbourne,Moving & Removal Services,Consumer Goods & Services,49420,Removal services
Removals - Industrial & Business,Professional & Commercial Services,Professional Services,49420,Removal services
Removals - Overseas,Moving & Removal Services,Consumer Goods & Services,49420,Removal services
Removals & Moving & Storage,Moving & Removal Services,Consumer Goods & Services,49420,Removal services
Removals Brokers,Moving & Removal Services,Consumer Goods & Services,49420,Removal services
Removals Deliveries,Moving & Removal Services,Consumer Goods & Services,49420,Removal services
Rendering,Food & Beverage Industry,Consumer Goods & Services,10110,Processing and preserving of meat
Renewable Energy,Renewable Energy,Utilities & Energy,35110,Production of electricity
Renewable Energy Equipment Manufacturing,Renewable Energy,Manufacturing & Industrials,27110,"Manufacture of electric motors, generators and transformers"
Renewable Energy Semiconductor Manufacturing,Technology Hardware & Peripherals,Manufacturing & Industrials,26110,Manufacture of electronic components
Renewable Energy Software & Services,Software Development & Services,Information Technology,62090,Other information technology service activities
Renewables Environment & Environmental Impact Assessments,Environmental Engineering & Services,Professional Services,74901,Environmental consulting activities
Rental Vehicles,Vehicle Rental,Transportation & Logistics,77110,Renting and leasing of cars and light motor vehicles
Repairing Carpets & Rugs,Specialized Consumer Services,Consumer Goods & Services,95240,Repair of furniture and home furnishings
Replacement Parts Distributor & Automotive Aftermarket Products,Auto Components,Automotive,45310,Wholesale trade of motor vehicle parts and accessories
Reproduction Furniture,Furniture,Manufacturing & Industrials,31090,Manufacture of other furniture
Reproductive Services,Health Care Providers & Services,Healthcare,86220,Specialists medical practice activities
Reptile Welfare,Veterinary Services & Supplies,Healthcare,75000,Veterinary activities
Requirements Setting,Consulting Services,Professional Services,70229,Management consultancy activities other than financial management
Research Organisations,Research & Development Services,Professional Services,72190,Other research and experimental development on natural sciences and engineering
Residential Care Homes,Health Care Providers & Services,Healthcare,87300,Residential care activities for the elderly and disabled
Residential Parks,Property Rental & Real Estate Services,Real Estate,68209,Other letting and operating of own or leased real estate
Resort,Hospitality Management & Services,Hospitality,55209,Other holiday and other collective accommodation
Resource Recovery & Recycling,Recycling & Waste Management,Manufacturing & Industrials,38320,Recovery of sorted materials
Responsible Pet Ownership,Pet Services & Supplies,Consumer Goods & Services,96090,Other service activities n.e.c.
Responsive Web Design,Web Development,Information Technology,62090,Other information technology service activities
Rest & Retirement Homes,Health Care Providers & Services,Healthcare,87300,Residential care activities for the elderly and disabled
Restaurant,"Hotels, Restaurants & Leisure",Hospitality,56101,Licenced restaurants
Restaurant Management & Development,Hospitality Management & Services,Hospitality,70229,Management consultancy activities other than financial management
Restaurant Management & Restaurant Development,Hospitality Management & Services,Hospitality,70229,Management consultancy activities other than financial management
Restaurants & Take Away Menus,"Hotels, Restaurants & Leisure",Hospitality,56101,Licenced restaurants
Restaurants Sports Bars,"Pubs, Bars & Inns",Hospitality,56101,Licenced restaurants
Restorative Dentistry,Health Care Providers & Services,Healthcare,86230,Dental practice activities
Retail - Wines Spirits & Beer/Liquor Store,"Retail - Wines, Spirits & Beer",Retail,47250,Retail sale of beverages in specialised stores
Retail & Wholesale Luggage,Specialty Retail,Retail,46499,Wholesale of household goods (other than musical instruments) n.e.c
Retail Carpets & Rugs,Furniture,Retail,47530,"Retail sale of carpets, rugs, wall and floor coverings in specialised stores"
Retail Channel Marketing,Marketing & Advertising,Marketing & Advertising,73110,Advertising agencies
Garden Ornament Wholesalers & Distributors,Garden Supplies,Manufacturing & Industrials,46760,Wholesale of other intermediate products
Retail Design,Design Services,Professional Services,74100,Specialised design activities
Retail Floorcoverings,Furniture,Retail,47530,"Retail sale of carpets, rugs, wall and floor coverings in specialised stores"
Retail Logistics,Logistics & Transportation,Transportation & Logistics,52290,Other transportation support activities
Retail Marketing,Marketing & Advertising,Marketing & Advertising,73110,Advertising agencies
Retail Optical Goods,Optical Goods,Retail,47782,Retail sale by opticians
Retail Soft Furnishings,Home Goods,Retail,47510,Retail sale of textiles in specialised stores
Retail Specialists & Hygiene Cleaning,Cleaning Supplies,Retail,81299,Other cleaning services
Retail Stores,General Retail & Services,Retail,47190,Other retail sale in non-specialised stores
Retailers & Makers Curtains,Home Goods,Retail,47510,Retail sale of textiles in specialised stores
Retirement Apartments,Health Care Providers & Services,Healthcare,87300,Residential care activities for the elderly and disabled
Reuse Of Furniture,General Retail & Services,Retail,47799,Retail sale of other second-hand goods in stores (not incl. antiques)
Reward Marketing,Marketing & Advertising,Marketing & Advertising,73110,Advertising agencies
RFID Microchip Identification,Electronic Equipment & Components,Manufacturing & Industrials,62090,Other information technology service activities
Rider Physiotherapy,Health Care Providers & Services,Healthcare,86900,Other human health activities
Ridesharing,Logistics & Transportation,Transportation & Logistics,49320,Taxi operation
"Riding Schools, Livery Stables & Equestrian Centres",Education Services,Education,85510,Sports and recreation education
Rigid Inflatable Boats & Inflatable Boats,Marine Engineering,Manufacturing & Industrials,30120,Building of pleasure and sporting boats
Riley System Transportation,Logistics & Transportation,Transportation & Logistics,49410,Freight transport by road
Risk Assessment,Consulting Services,Professional Services,70229,Management consultancy activities other than financial management
Risk Management,Consulting Services,Professional Services,70229,Management consultancy activities other than financial management
River & Inland Waterways,Shipping & Marine Transportation,Transportation & Logistics,50300,Inland passenger water transport
River Authorities,Government Services,Public Sector & Government,84110,General public administration activities
RMG Workers,Apparel,Consumer Goods & Services,82990,Other business support service activities n.e.c.
Road Construction And Road Marking,Construction & Engineering,Construction & Materials,42110,Construction of roads and motorways
Road Construction Equipment Manufacturers,Construction & Engineering,Manufacturing & Industrials,28923,Manufacture of equipment for concrete crushing and screening and roadworks
Road Construction Service Contractors,Construction & Engineering,Construction & Materials,42110,Construction of roads and motorways
Road Cycling,Sporting Goods,Consumer Goods & Services,93199,Other sports activities
Road Freight,Logistics & Transportation,Transportation & Logistics,49410,Freight transport by road
Road Haulage,Logistics & Transportation,Transportation & Logistics,49410,Freight transport by road
Road Marking & Surfacing Equipment & Material Manufacturers,Building Materials & Products,Manufacturing & Industrials,42110,Construction of roads and motorways
Road Surfacing Service,Construction & Engineering,Construction & Materials,42110,Construction of roads and motorways
Road Transport,Logistics & Transportation,Transportation & Logistics,49410,Freight transport by road
Roadside Breakdown,Automotive Services,Automotive,52219,"Other service activities incidental to land transportation, n.e.c."
Roasting Coffee & Coffee Wholesale,Food & Beverage Industry,Consumer Goods & Services,46370,"Wholesale of coffee, tea, cocoa and spices"
Robotic Radical Prostatectomy,Health Care Providers & Services,Healthcare,86220,Specialists medical practice activities
Robotics,Automation Services,Manufacturing & Industrials,28990,Manufacture of other special-purpose machinery n.e.c.
Roll Cage Sales & Service,Auto Components,Automotive,29201,Manufacture of bodies (coachwork) for motor vehicles (except caravans)
Rolling Shutters Manufacturers,Building Materials & Products,Construction & Materials,25120,Manufacture of doors and windows of metal
Romanian Wine,Beverage Manufacturing,Consumer Goods & Services,11020,Manufacture of wine from grape
Roof Cleaning,Commercial Cleaning Services,Professional Services,81222,Specialised cleaning services
Roof Coatings,Construction & Engineering,Construction & Materials,43910,Roofing activities
Roof Racks,Auto Components,Automotive,29320,Manufacture of other parts and accessories for motor vehicles
Roofing Services & Contractors,Construction & Engineering,Construction & Materials,43910,Roofing activities
Roofing Supplies & Materials,Building Materials & Products,Construction & Materials,46130,Agents involved in the sale of timber and building materials
Roofing Underdeck,Construction & Engineering,Construction & Materials,43910,Roofing activities
Ropes & Hawsers,Marine Engineering,Manufacturing & Industrials,13940,"Manufacture of cordage, rope, twine and netting"
Route Negotiability Studies,Traffic Engineering,Manufacturing & Industrials,71122,Engineering related scientific and technical consulting activities
Route Planners,Software Development & Services,Information Technology,62090,Other information technology service activities
Routine Care,Health Care Providers & Services,Healthcare,86900,Other human health activities
RPS Enviro Engineers,Environmental Engineering & Services,Manufacturing & Industrials,71122,Engineering related scientific and technical consulting activities
Rubber & Plastic Products Manufacturers,Plastics Manufacturing,Manufacturing & Industrials,22290,Manufacture of other plastic products
Rubber & Plastics Foam Products,Plastics Manufacturing,Manufacturing & Industrials,22290,Manufacture of other plastic products
Rubber Stamps,Office Equipment,Retail,32990,Other manufacturing n.e.c.
Rubbish Clearance,Recycling & Waste Management,Manufacturing & Industrials,38110,Collection of non-hazardous waste
Rubbish Removal,Recycling & Waste Management,Manufacturing & Industrials,38110,Collection of non-hazardous waste
Rug,Home Goods,Consumer Goods & Services,13939,Manufacture of other carpets and rugs
Rural Tree Planting,Forestry & Logging,Agriculture & Farming,02100,Silviculture and other forestry activities
Russian Restaurants,"Hotels, Restaurants & Leisure",Hospitality,56101,Licenced restaurants
SaaS,Software Development & Services,Information Technology,62090,Other information technology service activities
Saddlery & Riding Wear,Apparel,Consumer Goods & Services,15120,"Manufacture of luggage, handbags and the like, saddlery and harness"
Safe Deposits,Financial Services,Financial Services,80200,Security systems service activities
Safe Removers,Security Services & Equipment,Professional Services,49420,Removal services
Safes & Vaults - Suppliers & Installers,Security Services & Equipment,Manufacturing & Industrials,80200,Security systems service activities
Safety Equipment & Clothing,Safety Engineering,Manufacturing & Industrials,14120,Manufacture of workwear
Safety Glazing,Building Materials & Products,Manufacturing & Industrials,23120,Shaping and processing of flat glass
Safety Surfaces,Construction & Engineering,Construction & Materials,43330,Floor and wall covering
Safety/Workwear & Protective Equipment,Safety Engineering,Manufacturing & Industrials,14120,Manufacture of workwear
Sailing Schools,Education Services,Education,85510,Sports and recreation education
Sailmakers & Repairers,Marine Engineering,Manufacturing & Industrials,13921,Manufacture of soft furnishings
Sales,Sales & Marketing,Professional Services,46190,Agents involved in the sale of a variety of goods
Sales & Installation Doors & Shutters,Construction & Engineering,Construction & Materials,43290,Other construction installation
Sales & Marketing,Sales & Marketing,Marketing & Advertising,73110,Advertising agencies
Sales & Marketing & Automotive,Automotive Services,Automotive,45111,Sale of new cars and light motor vehicles
