sub_industry,Industry,sector,sic_code,sic_description
Direct/Indirect Spend Analysis,Consulting Services,Professional Services,70229,Management consultancy activities other than financial management
Directories,Publishing,"Media, Publishing & Entertainment",58120,Publishing of directories and mailing lists
Directories Advertising,Marketing & Advertising,Marketing & Advertising,73120,Media representation services
Directory Enquiries,Information Services,Information Technology,61900,Other telecommunications activities
Directory Publishers,Publishing,"Media, Publishing & Entertainment",58120,Publishing of directories and mailing lists
Dirt Bikes,Automobiles,Retail,30910,Manufacture of motorcycles
Disability Services and Support Organization,Civic & Social Organizations,Public Sector & Government,88100,Social work activities without accommodation for the elderly and disabled
Disabled Parking Permit Holders,Government Services,Public Sector & Government,84110,General public administration activities
Disco Equipment,Electronics Retail,Retail,47430,Retail sale of audio and video equipment in specialised stores
Discos,Entertainment Services,"Media, Publishing & Entertainment",93290,Other amusement and recreation activities n.e.c.
Discount Centres,General Retail & Services,Retail,47190,Other retail sale in non-specialised stores
Dishwasher - Servicing & Repairs,Specialized Consumer Services,Consumer Goods & Services,95220,Repair of household appliances and home and garden equipment
Dishwashers - Sales & Service,Electronics Retail,Retail,47540,Retail sale of electrical household appliances in specialised stores
Dispensing Opticians (DOs),Health Care Providers & Services,Healthcare,86900,Other human health activities
Dispensing Pharmacist,Pharmaceuticals & Biotechnology,Healthcare,47730,Dispensing chemist in specialised stores
Display & Window Dressing Services,Design Services,Professional Services,82990,Other business support service activities n.e.c.
Display Fixtures & Fittings,Specialty Retail,Retail,31010,Manufacture of office and shop furniture
Disposable Gloves,Medical Devices & Services,Retail,46900,Non-specialised wholesale trade
Disposable Paper Products,Packaging & Paper Products,Manufacturing & Industrials,17220,Manufacture of household and sanitary goods and of toilet requisites
Disposable Products,Packaging & Paper Products,Manufacturing & Industrials,22220,Manufacture of plastic packing goods
Distilleries,Beverage Manufacturing,Consumer Goods & Services,11010,"Distilling, rectifying and blending of spirits"
Distribution,Logistics & Transportation,Transportation & Logistics,52103,Operation of warehousing and storage facilities for land transport activities
Distribution Automobile,Automotive Services,Automotive,45111,Sale of new cars and light motor vehicles
Distribution Of Orangina & Limona,Beverage Distribution,Consumer Goods & Services,46341,"Wholesale of fruit and vegetable juices, mineral water and soft drinks"
Distribution Partner,Logistics & Transportation,Transportation & Logistics,52290,Other transportation support activities
Distribution Planning,Inventory & Supply Chain Management,Professional Services,70229,Management consultancy activities other than financial management
Distribution Services,Logistics & Transportation,Transportation & Logistics,52290,Other transportation support activities
District Administration,Public Sector & Government,Public Sector & Government,84110,General public administration activities
Diversified Capital Markets,Capital Markets,Financial Services,66110,Administration of financial markets
Diving Equipment & Supplies,Sporting Goods,Consumer Goods & Services,32300,Manufacture of sports goods
Diving Schools,Education Services,Education,85530,Driving school activities
Do It Yourself Shops,Home Improvement,Retail,47520,"Retail sale of hardware, paints and glass in specialised stores"
Do It Yourself Wholesalers (DIY),Building Materials & Products,Construction & Materials,46740,"Wholesale of hardware, plumbing and heating equipment and supplies"
Doctors/Physicians,Health Care Providers & Services,Healthcare,86210,General medical practice activities
Document Image Processing Systems,Software Development & Services,Information Technology,62090,Other information technology service activities
Document Management,Software Development & Services,Information Technology,82190,"Photocopying, document preparation and other specialised office support activities"
Document Management Services,Software Development & Services,Information Technology,82190,"Photocopying, document preparation and other specialised office support activities"
Dog & Cat Splints,Veterinary Services & Supplies,Healthcare,75000,Veterinary activities
Dog Behaviour & Canine Fertility,Pet Services & Supplies,Consumer Goods & Services,75000,Veterinary activities
Dog Behaviour & Training,Pet Services & Supplies,Consumer Goods & Services,96090,Other service activities n.e.c.
Dog Boarding,Pet Services & Supplies,Consumer Goods & Services,96090,Other service activities n.e.c.
Dog Clipping & Grooming/Pet Groomers,Pet Services & Supplies,Consumer Goods & Services,96090,Other service activities n.e.c.
Dog Grooming,Pet Services & Supplies,Consumer Goods & Services,96090,Other service activities n.e.c.
Dog Kennels - Manufacturers & Suppliers,Pet Services & Supplies,Consumer Goods & Services,32990,Other manufacturing n.e.c.
Dog Walking & Pet Visits,Pet Services & Supplies,Consumer Goods & Services,96090,Other service activities n.e.c.
Doggy Day Care,Pet Services & Supplies,Consumer Goods & Services,96090,Other service activities n.e.c.
Dolls & Dolls' Houses,Toys & Games,Retail,47650,Retail sale of games and toys in specialised stores
Dolls' Hospitals,Specialized Consumer Services,Consumer Goods & Services,96090,Other service activities n.e.c.
Domestic Appliances - Sales,Electronics Retail,Retail,47540,Retail sale of electrical household appliances in specialised stores
Domestic Delivery,Logistics & Transportation,Transportation & Logistics,53201,Licensed carriers
"Domestic Door Manufacturers, Wooden Door Manufacturer",Machinery & Manufacturing Services,Manufacturing & Industrials,16230,Manufacture of other builders' carpentry and joinery
Domestic Energy Assessors,Energy Consulting & Services,Utilities & Energy,71200,Technical testing and analysis
Domestic Pallet Network,Logistics & Transportation,Transportation & Logistics,52290,Other transportation support activities
Domestic Staff,Specialized Consumer Services,Consumer Goods & Services,97000,Activities of households as employers of domestic personnel
Door & Window Guards & Grilles,Metal Fabrication,Manufacturing & Industrials,25120,Manufacture of doors and windows of metal
Door And Gate Operators,Security Services & Equipment,Manufacturing & Industrials,28290,Manufacture of other general-purpose machinery n.e.c.
Door Repairing Service,Specialized Consumer Services,Consumer Goods & Services,95220,Repair of household appliances and home and garden equipment
Door Stockists,Building Materials & Products,Construction & Materials,46740,"Wholesale of hardware, plumbing and heating equipment and supplies"
Door To Door Services,Logistics & Transportation,Transportation & Logistics,53202,Unlicensed carriers
Dormant Company,Business Services,Professional Services,99999,Dormant company
Double Glazing Installers,Construction & Engineering,Construction & Materials,43342,Glazing
Double Glazing Repairs,Specialized Consumer Services,Consumer Goods & Services,43342,Glazing
Double Glazing Suppliers,Building Materials & Products,Retail,43342,Glazing
Draft Beer Systems,"Pubs, Bars & Inns",Hospitality,56302,Public houses and bars
Drain & Sewer Clearance - Equipment,Industrial Equipment & Supplies,Manufacturing & Industrials,28290,Manufacture of other general-purpose machinery n.e.c.
Drainage Contractors,Construction & Engineering,Construction & Materials,43999,Other specialised construction activities n.e.c.
Drainage Systems Manufacturer,Industrial Equipment & Supplies,Manufacturing & Industrials,28220,Manufacture of lifting and handling equipment
Drama Schools,Education Services,Education,85520,Cultural education
Draught Proofing Installer,Construction Services,Construction & Materials,43290,Other construction installation
Draughtsmen & Drawing Services,Design Services & Engineering,Professional Services,71111,Architectural activities
Drawing Office Equipment & Supplies,Office Equipment,Retail,46660,Wholesale of other office machinery and equipment
Dress Agencies,Apparel,Consumer Goods & Services,47710,Retail sale of clothing in specialised stores
Dresses,Apparel,Consumer Goods & Services,14132,Manufacture of other women's outerwear
Dressmakers,Apparel,Consumer Goods & Services,14132,Manufacture of other women's outerwear
Dresswear Hire,Apparel,Consumer Goods & Services,77299,Renting and leasing of other personal and household goods
Drilling & Boring Equipment & Supplies,Industrial Equipment & Supplies,Manufacturing & Industrials,28240,Manufacture of power-driven hand tools
Beverage Brands & Snack Brands,Food & Beverage Industry,Manufacturing & Industrials,10890,Manufacture of other food products n.e.c.
Drinking Water Solutions For Office & Home,Utility Services & Water Services,Utilities & Energy,36000,"Water collection, treatment and supply"
Drinks,Beverage Distribution,Consumer Goods & Services,11070,Manufacture of soft drinks; production of mineral waters and other bottled waters
Driver And Vehicle Licensing Agency (DVLA),Government Services,Public Sector & Government,84110,General public administration activities
Driver Assessments,Education Services,Education,85530,Driving school activities
Driver Behaviour & Fatigue Monitoring,Fleet Management,Transportation & Logistics,82990,Other business support service activities n.e.c.
Driver Hire,Human Resources & Employment Services,Professional Services,78200,Temporary employment agency activities
Driver Training & Transport Management Training,Education Services,Education,85530,Driving school activities
Drivers Of Deforestation,Environmental Engineering & Services,Professional Services,74901,Environmental consulting activities
Drivers On Demand & Food Delivery,Logistics & Transportation,Transportation & Logistics,53202,Unlicensed carriers
Driving,Education Services,Education,85530,Driving school activities
Driving Instructor Training,Education Services,Education,85530,Driving school activities
Driving Recruitment,Human Resources & Employment Services,Professional Services,78109,Other activities of employment placement agencies
Drug & Alcohol Testing,Laboratory Services,Healthcare,86900,Other human health activities
Drug And Alcohol Addiction Counselling,Health Care Providers & Services,Healthcare,86900,Other human health activities
Drug Development,Pharmaceuticals & Biotechnology,Pharmaceuticals & Biotechnology,72110,Research and experimental development on biotechnology
Drug Stores/Pharmacies,Pharmaceuticals & Biotechnology,Healthcare,47730,Dispensing chemist in specialised stores
"Drums, Kegs, Barrels & Casks",Packaging & Paper Products,Manufacturing & Industrials,25910,Manufacture of steel drums and similar containers
Dry Cleaners/Laundry Services,Specialized Consumer Services,Consumer Goods & Services,96010,Washing and (dry-)cleaning of textile and fur products
Dry Ice Pellets,Chemical Products & Chemicals,Construction & Materials,20110,Manufacture of industrial gases
Dry Lining Contractors,Construction & Engineering,Construction & Materials,43310,Plastering
Dry Rot Treatment,Construction & Engineering,Construction & Materials,43999,Other specialised construction activities n.e.c.
Dry Stone Walling,Construction & Engineering,Construction & Materials,43999,Other specialised construction activities n.e.c.
Ducting & Duct Fittings,Mechanical Engineering,Manufacturing & Industrials,28250,Manufacture of non-domestic cooling and ventilation equipment
Dump Truck Services,Logistics & Transportation,Transportation & Logistics,49410,Freight transport by road
Dust Extraction Systems,Industrial Equipment & Supplies,Manufacturing & Industrials,28250,Manufacture of non-domestic cooling and ventilation equipment
Dust Extraction Systems Plant & Equipment Manufacturers,Industrial Equipment & Supplies,Manufacturing & Industrials,28250,Manufacture of non-domestic cooling and ventilation equipment
Duty Drawback,Logistics & Transportation,Transportation & Logistics,82990,Other business support service activities n.e.c.
DVD & Video Libraries,Media Production & Services,"Media, Publishing & Entertainment",77220,Renting of video tapes and disks
Dyslexia Assessment And Identification,Health Care Providers & Services,Healthcare,85600,Educational support services
Earth Works,Construction & Engineering,Construction & Materials,43120,Site preparation
Ebay Shipping,Logistics & Transportation,Transportation & Logistics,47910,Retail sale via mail order houses or via Internet
Ebike Specialist,Automobiles,Retail,45190,Sale of other motor vehicles
Echocardiography & Cardiology,Health Care Providers & Services,Healthcare,86220,Specialists medical practice activities
Eco-Friendly Products,Consumer Goods,Consumer Goods & Services,32990,Other manufacturing n.e.c.
Ecological Clerk Of Works,Environmental Engineering & Services,Professional Services,74901,Environmental consulting activities
Ecological Consultancy,Environmental Engineering & Services,Professional Services,74901,Environmental consulting activities
Ecological Contracting,Environmental Engineering & Services,Construction & Materials,43999,Other specialised construction activities n.e.c.
Ecology,Environmental Engineering & Services,Professional Services,74901,Environmental consulting activities
Ecommerce,E-commerce,Information Technology,47910,Retail sale via mail order houses or via Internet
Ecommerce Automation & Software,Software Development & Services,Information Technology,62090,Other information technology service activities
Ecommerce Delivery,Logistics & Transportation,Transportation & Logistics,53201,Licensed carriers
Ecommerce Fulfillment,Logistics & Transportation,Transportation & Logistics,82990,Other business support service activities n.e.c.
Ecommerce Order Fulfilment,Logistics & Transportation,Transportation & Logistics,82990,Other business support service activities n.e.c.
Ecommerce Pick,Logistics & Transportation,Transportation & Logistics,82990,Other business support service activities n.e.c.
Ecommerce Service,E-commerce,Information Technology,47910,Retail sale via mail order houses or via Internet
Editorial & Proof Reading Services,Publishing,"Media, Publishing & Entertainment",82990,Other business support service activities n.e.c.
Education Agencies & Authorities,Government Services,Public Sector & Government,84120,"Regulation of health care, education, cultural and other social services, not incl. social security"
Education Catering,Catering & Contract Catering,Hospitality,56210,Event catering activities
Education In Osteosynthesis,Education Services,Education,85410,Post-secondary non-tertiary education
Education Management,Education Services,Education,85600,Educational support services
Educational Accreditation,Education Services,Education,85600,Educational support services
Educational Brewing Classes,Education Services,Education,85590,Other education n.e.c.
Educational Equipment & Supplies,Education Services,Retail,85600,Educational support services
Educational Services,Education Services,Education,85600,Educational support services
Educational Training Providers,Education Services,Education,85590,Other education n.e.c.
Elastic Goods,"Textiles, Apparel & Luxury Goods",Consumer Goods & Services,13960,Manufacture of other technical and industrial textiles
E-Learning,Education Services,Education,85590,Other education n.e.c.
Electric Adjustable Beds,Furniture,Retail,47599,"Retail of furniture, lighting, and similar (not musical instruments or scores) in specialised store"
Electric Bikes,Automobiles,Retail,30910,Manufacture of motorcycles
Electric Motor Manufacturers,Electrical Equipment & Goods,Manufacturing & Industrials,27110,"Manufacture of electric motors, generators and transformers"
Electric Motor Sales & Service,Electrical Equipment & Goods,Manufacturing & Industrials,33140,Repair of electrical equipment
Electric Power Transmission,Utility Services & Water Services,Utilities & Energy,35120,Transmission of electricity
Electric Vehicle (EV),Automobiles,Automotive,29100,Manufacture of motor vehicles
Electric Vehicle Charging Station Contractor,Electrical Engineering,Construction & Materials,43210,Electrical installation
Electric Vehicle Design,Automotive Engineering,Automotive,29100,Manufacture of motor vehicles
Electrical Appliance - Servicing & Repairs,Specialized Consumer Services,Consumer Goods & Services,95220,Repair of household appliances and home and garden equipment
Electrical contractor,Electrical Engineering,Construction & Materials,43210,Electrical installation
Electrical Distribution Companies,Utility Services & Water Services,Utilities & Energy,35130,Distribution of electricity
Electrical Engineers,Electrical Engineering,Manufacturing & Industrials,71121,Engineering design activities for industrial process and production
"Electrical Goods Sales, Manufacturers & Wholesalers",Electronics Retail,Retail,46439,"Wholesale of radio, television goods & electrical household appliances (other than records, tapes, CD's & video tapes and the equipment used for playing them)"
Electrical Heating Equipment & Systems,Electrical Equipment & Goods,Manufacturing & Industrials,27900,Manufacture of other electrical equipment
Electrical Testing & Inspecting,Electrical Engineering,Manufacturing & Industrials,71200,Technical testing and analysis
Electrical Wholesalers,Electrical Equipment & Goods,Manufacturing & Industrials,46520,Wholesale of electronic and telecommunications equipment and parts
Electrician,Electrical Engineering,Construction & Materials,43210,Electrical installation
Electricians/Electrical Installation Services,Electrical Engineering,Construction & Materials,43210,Electrical installation
Electricity,Utility Services & Water Services,Utilities & Energy,35110,Production of electricity
Electricity Generating & Distributing Equipment,Electrical Equipment & Goods,Manufacturing & Industrials,27120,Manufacture of electricity distribution and control apparatus
Electro Chemical Water Treatment,Water Engineering,Manufacturing & Industrials,36000,"Water collection, treatment and supply"
Electro Mechanical,Electrical Equipment & Goods,Manufacturing & Industrials,27120,Manufacture of electricity distribution and control apparatus
Electrolysis & Laser Hair Removal,Personal Care & Services,Consumer Goods & Services,96020,Hairdressing and other beauty treatment
Electronic Bills Of Lading Eb,Digital Services,Information Technology,62090,Other information technology service activities
Electronic Cigarettes,Tobacco,Consumer Goods & Services,12000,Manufacture of tobacco products
Electronic Components,Electronic Equipment & Components,Manufacturing & Industrials,26110,Manufacture of electronic components
Electronic Engineers,Electronics Engineering,Manufacturing & Industrials,71121,Engineering design activities for industrial process and production
Electronic Parts Supply,Electronic Equipment & Components,Manufacturing & Industrials,46520,Wholesale of electronic and telecommunications equipment and parts
Electronics Manufacturing,Electronic Equipment & Components,Manufacturing & Industrials,26110,Manufacture of electronic components
Elevator Maintenance Services/Servicing & Repairs,Specialized Consumer Services,Consumer Goods & Services,43290,Other construction installation
Elevator Manufacturers,Industrial Equipment & Supplies,Manufacturing & Industrials,28220,Manufacture of lifting and handling equipment
Email Marketing,Mail Services,Information Technology,73110,Advertising agencies
Embassy,Government Services,Public Sector & Government,84110,General public administration activities
Embroiderers,"Textiles, Apparel & Luxury Goods",Consumer Goods & Services,13990,Manufacture of other textiles n.e.c.
Embroidery Machines,"Textiles, Apparel & Luxury Goods",Manufacturing & Industrials,28940,"Manufacture of machinery for textile, apparel and leather production"
Emergency & Critical Care,Health Care Providers & Services,Healthcare,86900,Other human health activities
Emergency Dental Treatment,Health Care Providers & Services,Healthcare,86230,Dental practice activities
Emergency Medicine,Health Care Providers & Services,Healthcare,86101,Hospital activities
Emergency Pet Hospital,Veterinary Services & Supplies,Healthcare,75000,Veterinary activities
Emergency Plumbing,Construction Services,Construction & Materials,43220,"Plumbing, heat and air-conditioning installation"
Emergency Transport,Logistics & Transportation,Transportation & Logistics,49390,Other passenger land transport
Emission Regulation,Environmental Engineering & Services,Professional Services,74901,Environmental consulting activities
Emissions Testing,Environmental Engineering & Services,Manufacturing & Industrials,71200,Technical testing and analysis
Employee Assistance Programs,Human Resources & Employment Services,Professional Services,82990,Other business support service activities n.e.c.
Employee Discounts,Human Resources & Employment Services,Professional Services,82990,Other business support service activities n.e.c.
Employee Engagement,Human Resources & Employment Services,Professional Services,70229,Management consultancy activities other than financial management
Employee Wellness,Health Care Providers & Services,Healthcare,86900,Other human health activities
Employment & Recruitment Agencies,Human Resources & Employment Services,Professional Services,78109,Other activities of employment placement agencies
Employment Law - Solicitors,Legal Services,Professional Services,69102,Solicitors
Employment Services,Human Resources & Employment Services,Professional Services,78109,Other activities of employment placement agencies
Enamelling,Metal Fabrication,Manufacturing & Industrials,25610,Treatment and coating of metals
End Of Life Care,Health Care Providers & Services,Healthcare,86101,Hospital activities
Endangered Species Conservation,Environmental Engineering & Services,Manufacturing & Industrials,74901,Environmental consulting activities
Energy & Carbon Strategy,Energy Consulting & Services,Utilities & Energy,74901,Environmental consulting activities
Energy Assessors - Commercial,Energy Consulting & Services,Utilities & Energy,71200,Technical testing and analysis
Energy Assessors - Domestic,Energy Consulting & Services,Utilities & Energy,71200,Technical testing and analysis
Energy Assessors-Domestic,Energy Consulting & Services,Utilities & Energy,71200,Technical testing and analysis
Energy Conservation Consultants & Equipment,Energy Consulting & Services,Utilities & Energy,74901,Environmental consulting activities
Energy Consultancy,Energy Consulting & Services,Utilities & Energy,74901,Environmental consulting activities
Energy Contracts,Energy Trading & Marketing,Utilities & Energy,35140,Trade of electricity
Energy Drinks,Beverage Distribution,Consumer Goods & Services,11070,Manufacture of soft drinks; production of mineral waters and other bottled waters
Energy Efficiency Audits,Energy Consulting & Services,Utilities & Energy,74901,Environmental consulting activities
Energy Efficient Commercial Refrigeration,Mechanical Engineering,Manufacturing & Industrials,28250,Manufacture of non-domestic cooling and ventilation equipment
Energy Efficient Products And Services,Energy Consulting & Services,Manufacturing & Industrials,43210,Electrical installation
Energy Management,Energy Consulting & Services,Utilities & Energy,74901,Environmental consulting activities
Energy Management Control Systems,Energy Management Services,Utilities & Energy,26512,Manufacture of electronic industrial process control equipment
Energy Management Programmes,Energy Consulting & Services,Utilities & Energy,74901,Environmental consulting activities
Energy Performance Certificates,Energy Consulting & Services,Utilities & Energy,71200,Technical testing and analysis
Engine Manufacturers & Distributors,Automobiles,Automotive,28110,"Manufacture of engines and turbines, except aircraft, vehicle and cycle engines"
Engine Rebuilding & Reconditioning,Automotive Services,Consumer Goods & Services,45200,Maintenance and repair of motor vehicles
Engineering Consulting Services,Engineering Services,Professional Services,71129,Other engineering activities
Engineering Machine Services & Maintenance,Industrial Equipment & Supplies,Manufacturing & Industrials,33120,Repair of machinery
Engineering Materials,Materials & Metals,Manufacturing & Industrials,71129,Other engineering activities
Engineering Personnel,Human Resources & Employment Services,Professional Services,78200,Temporary employment agency activities
Engineers - General,General Engineering,Manufacturing & Industrials,71129,Other engineering activities
Engineers' Merchants,Industrial Equipment & Supplies,Manufacturing & Industrials,46690,Wholesale of other machinery and equipment
Engines - Sales & Service,Industrial Equipment & Supplies,Manufacturing & Industrials,45310,Wholesale trade of motor vehicle parts and accessories
English Restaurants,"Hotels, Restaurants & Leisure",Hospitality,56101,Licenced restaurants
Engraving Services,Printing Services & Engineering,Manufacturing & Industrials,25990,Manufacture of other fabricated metal products n.e.c.
Enterprise Ecommerce,E-commerce,Information Technology,62090,Other information technology service activities
Enterprise Software,Software Development & Services,Information Technology,62012,Business and domestic software development
Entertainment,Entertainment Services,"Media, Publishing & Entertainment",90010,Performing arts
