sub_industry,Industry,sector,sic_code,sic_description
Jukebox,Music Equipment,Consumer Goods & Services,26400,Manufacture of consumer electronics
Jura Coffee Machines,Household Goods & Services,Manufacturing & Industrials,28250,Manufacture of non-domestic cooling and ventilation equipment
Karaoke,Entertainment Services,"Media, Publishing & Entertainment",93290,Other amusement and recreation activities n.e.c.
Key Cutting,Specialized Consumer Services,Consumer Goods & Services,95290,Repair of personal and household goods n.e.c.
Kids Nutrition,Food & Beverage Industry,Consumer Goods & Services,10890,Manufacture of other food products n.e.c.
Kilt Hire,Apparel,Consumer Goods & Services,14190,Manufacture of other wearing apparel and accessories n.e.c.
King Brewers,Beverage Manufacturing,Consumer Goods & Services,11050,Manufacture of beer
Kitchen Appliances,Household Goods & Services,Manufacturing & Industrials,27510,Manufacture of electric domestic appliances
Kitchen Building,Architectural Services,Construction & Materials,43390,Other building completion and finishing
Kitchen Extraction,Mechanical Engineering,Manufacturing & Industrials,28250,Manufacture of non-domestic cooling and ventilation equipment
Kitchen Furniture Manufacturers,Furniture,Manufacturing & Industrials,31020,Manufacture of kitchen furniture
Kitchen Installation & Supply,Architectural Services,Construction & Materials,43390,Other building completion and finishing
Kitchen Planners & Furnishers,Furniture,Manufacturing & Industrials,74100,Specialised design activities
Kitchen Rental,Events Management,Professional Services,68209,Other letting and operating of own or leased real estate
Kitchen Retailer,Home Goods,Retail,47540,Retail sale of electrical household appliances in specialised stores
Kitchen Ware,Home Goods,Retail,47540,Retail sale of electrical household appliances in specialised stores
Kites,Toys & Games,Consumer Goods & Services,32300,Manufacture of sports goods
Kitten Rescue,Pet Services & Supplies,Consumer Goods & Services,75000,Veterinary activities
Knife Sharpening,Specialized Consumer Services,Consumer Goods & Services,33110,Repair of fabricated metal products
Knitting,"Textiles, Apparel & Luxury Goods",Consumer Goods & Services,14390,Manufacture of other knitted and crocheted apparel
Knitting & Crochet Yarn Supplies,Specialty Retail,Retail,47510,Retail sale of textiles in specialised stores
Knitting Machine Manufacturers & Distributors,"Textiles, Apparel & Luxury Goods",Manufacturing & Industrials,28940,"Manufacture of machinery for textile, apparel and leather production"
Knitting Machines & Supplies,"Textiles, Apparel & Luxury Goods",Manufacturing & Industrials,46640,Wholesale of machinery for the textile industry and of sewing and knitting machines
Knitting Yarn Manufacturers & Wholesalers,"Textiles, Apparel & Luxury Goods",Consumer Goods & Services,46410,Wholesale of textiles
Knitwear Manufacturers & Wholesalers,Apparel,Consumer Goods & Services,14390,Manufacture of other knitted and crocheted apparel
Knowledge Entertainment Inspiration,Media & Entertainment,"Media, Publishing & Entertainment",59113,Television programme production activities
Kosher Catering,Catering & Contract Catering,Hospitality,56210,Event catering activities
Jellies,Food & Beverage Industry,Manufacturing & Industrials,10822,Manufacture of sugar confectionery
Label Validation,Printing Services & Engineering,Manufacturing & Industrials,18121,Manufacture of printed labels
Labels & Tags,Printing Services & Engineering,Manufacturing & Industrials,18121,Manufacture of printed labels
Laboratory,Laboratory Services,Healthcare,72190,Other research and experimental development on natural sciences and engineering
Laboratory Diagnostics,Laboratory Services,Healthcare,86900,Other human health activities
Laboratory Equipment,Medical Devices & Services,Healthcare,26511,"Manufacture of electronic measuring, testing etc. equipment, not for industrial process control"
"Laboratory Equipment, Instruments & Supplies",Medical Devices & Services,Healthcare,32500,Manufacture of medical and dental instruments and supplies
Laboratory Testing & Diagnosis Service,Laboratory Services,Healthcare,71200,Technical testing and analysis
Lace Manufacturers,"Textiles, Apparel & Luxury Goods",Consumer Goods & Services,13990,Manufacture of other textiles n.e.c.
Ladder Manufacturers,Industrial Equipment & Supplies,Manufacturing & Industrials,25110,Manufacture of metal structures and parts of structures
Ladder Sales,Industrial Equipment & Supplies,Manufacturing & Industrials,46740,"Wholesale of hardware, plumbing and heating equipment and supplies"
Ladies' Clothes Shops,Apparel,Consumer Goods & Services,47710,Retail sale of clothing in specialised stores
Laminate Wood Flooring,Machinery & Manufacturing Services,Manufacturing & Industrials,16210,Manufacture of veneer sheets and wood-based panels
Lamination & Encapsulation Services,Printing Services & Engineering,Manufacturing & Industrials,18129,Printing n.e.c.
Lamp Shop,Home Goods,Retail,47599,"Retail of furniture, lighting, and similar (not musical instruments or scores) in specialised store"
Lampshade Manufacturers & Distributors,Lighting Engineering,Manufacturing & Industrials,27400,Manufacture of electric lighting equipment
Land Agents/Real Estate Agencies,Property Rental & Real Estate Services,Real Estate,68310,Real estate agencies
Land Management,Landscaping,Construction & Materials,81300,Landscape service activities
Landfill Gas & Leachate Monitoring,Environmental Engineering & Services,Manufacturing & Industrials,38210,Treatment and disposal of non-hazardous waste
Landfill Operations,Recycling & Waste Management,Manufacturing & Industrials,38210,Treatment and disposal of non-hazardous waste
Landscape Architect,Architectural Services,Construction & Materials,71112,Urban planning and landscape architectural activities
Landscape Lighting Designing,Electrical Engineering,Construction & Materials,43210,Electrical installation
Landscaper,Landscaping,Construction & Materials,81300,Landscape service activities
Landscaping,Landscaping,Construction & Materials,81300,Landscape service activities
Language Schools,Education Services,Education,85590,Other education n.e.c.
Laparoscopy,Medical Devices & Services,Healthcare,32500,Manufacture of medical and dental instruments and supplies
Laptop And Computer Accessories,Technology Hardware & Peripherals,Manufacturing & Industrials,46510,"Wholesale of computers, computer peripheral equipment and software"
Large Plant Movements,Logistics & Transportation,Transportation & Logistics,49410,Freight transport by road
Laser Cutting Services,Metal Fabrication,Manufacturing & Industrials,25620,Machining
Laser Eye Treatment,Health Care Providers & Services,Healthcare,86900,Other human health activities
Laser Therapy,Health Care Providers & Services,Healthcare,86900,Other human health activities
Last Mile Delivery,Logistics & Transportation,Transportation & Logistics,53202,Unlicensed carriers
Last Mile Delivery Solutions & Logistics,Logistics & Transportation,Transportation & Logistics,53202,Unlicensed carriers
Last Mile Distribution,Logistics & Transportation,Transportation & Logistics,53202,Unlicensed carriers
Last Mile Fashion Deliveries,Logistics & Transportation,Transportation & Logistics,53202,Unlicensed carriers
Laundries & Launderettes,Specialized Consumer Services,Consumer Goods & Services,96010,Washing and (dry-)cleaning of textile and fur products
Kosher Food Products,Food & Beverage Industry,Manufacturing & Industrials,10890,Manufacture of other food products n.e.c.
Laundry Equipment Manufacturers & Suppliers,Industrial Equipment & Supplies,Manufacturing & Industrials,28290,Manufacture of other general-purpose machinery n.e.c.
Laundry Equipment Service Parts & Sales,Industrial Equipment & Supplies,Manufacturing & Industrials,33200,Installation of industrial machinery and equipment
Lawn Care & Maintenance Services,Grounds Maintenance & Landscaping,Construction & Materials,81300,Landscape service activities
Lawn Sprinkler System Contractor,Landscaping,Construction & Materials,81300,Landscape service activities
Lawnmowers & Garden Machinery Sales & Service,Garden Supplies,Retail,46610,"Wholesale of agricultural machinery, equipment and supplies"
Lead Acid Batteries,Machinery & Manufacturing Services,Manufacturing & Industrials,27200,Manufacture of batteries and accumulators
Lead Generation,Marketing & Advertising,Marketing & Advertising,73200,Market research and public opinion polling
Leaded Lights & Windows,Materials & Metals,Manufacturing & Industrials,23190,"Manufacture and processing of other glass, including technical glassware"
Leak Detection Services,Construction Services,Construction & Materials,71200,Technical testing and analysis
Learning Centre,Education Services,Education,85590,Other education n.e.c.
Leasing Non-residential Real Estate,Property Rental & Real Estate Services,Real Estate,68209,Other letting and operating of own or leased real estate
Leasing Pictures,Art & Craft,Consumer Goods & Services,47781,Retail sale in commercial art galleries
Leasing Services,Property Rental & Real Estate Services,Real Estate,64910,Financial leasing
Leather Garments & Products,Apparel,Consumer Goods & Services,14110,Manufacture of leather clothes
Leather Goods Shops,Apparel,Consumer Goods & Services,47722,Retail sale of leather goods in specialised stores
Leather Merchants & Wholesalers,Apparel,Consumer Goods & Services,46240,"Wholesale of hides, skins and leather"
Leather Repair And Restoration,Specialized Consumer Services,Consumer Goods & Services,95230,Repair of footwear and leather goods
Lebanese Restaurants,"Hotels, Restaurants & Leisure",Hospitality,56101,Licenced restaurants
Led Delivery Boxes,Industrial Equipment & Supplies,Manufacturing & Industrials,27400,Manufacture of electric lighting equipment
Legal Compliance,Legal Services,Professional Services,69109,Activities of patent and copyright agents; other legal activities n.e.c.
Legal Helplines,Legal Services,Professional Services,69102,Solicitors
Legionella Control,Environmental Engineering & Services,Manufacturing & Industrials,71200,Technical testing and analysis
Leisure & Recreation Centres,Travel & Leisure,Hospitality,93290,Other amusement and recreation activities n.e.c.
Leisure & Sportswear Manufacturers,Apparel,Consumer Goods & Services,14190,Manufacture of other wearing apparel and accessories n.e.c.
Leisure Goods,Leisure Products,Consumer Goods & Services,47640,"Retail sale of sports goods, fishing gear, camping goods, boats and bicycles"
Letterbox Brownies,Food & Beverage Industry,Manufacturing & Industrials,10720,Manufacture of rusks and biscuits; manufacture of preserved pastry goods and cakes
Letting Agents/Real Estate Agencies,Property Rental & Real Estate Services,Real Estate,68310,Real estate agencies
Lev Testing,Professional & Commercial Services,Professional Services,71200,Technical testing and analysis
LGV Driving Course,Education Services,Education,85530,Driving school activities
LGV Training,Education Services,Education,85530,Driving school activities
Libraries,Information Services,Education,91011,Library activities
Life Assurance,Insurance,Financial Services,65110,Life insurance
Life Coaching & Mentoring,Professional & Commercial Services,Professional Services,96090,Other service activities n.e.c.
Lift Manufacturers,Industrial Equipment & Supplies,Manufacturing & Industrials,28220,Manufacture of lifting and handling equipment
Lifting Operations And Lifting Equipment,Equipment Rental,Manufacturing & Industrials,77320,Renting and leasing of construction and civil engineering machinery and equipment
Lighting Consultants,Lighting Engineering,Manufacturing & Industrials,71122,Engineering related scientific and technical consulting activities
Lighting Contractors,Construction & Engineering,Construction & Materials,43210,Electrical installation
Lighting Manufacturers,Manufacturing & Industrials,Manufacturing & Industrials,27400,Manufacture of electric lighting equipment
Lighting Project Consultants,Lighting Engineering,Manufacturing & Industrials,71122,Engineering related scientific and technical consulting activities
Lighting Retailers,Home Goods,Retail,47599,"Retail of furniture, lighting, and similar (not musical instruments or scores) in specialised store"
Lighting Wholesalers,Electrical Equipment & Goods,Manufacturing & Industrials,46470,"Wholesale of furniture, carpets and lighting equipment"
Lightning Conductors/Lightning Rod,Electrical Engineering,Construction & Materials,43210,Electrical installation
"Lime Powder Manufacturers & OEM Manufacturers, Distributors",Building Materials & Products,Manufacturing & Industrials,23520,Manufacture of lime and plaster
Limousine Hire/Rental,Logistics & Transportation,Transportation & Logistics,49320,Taxi operation
Linen Hire/Laundry Service,Specialized Consumer Services,Consumer Goods & Services,96010,Washing and (dry-)cleaning of textile and fur products
"Lingerie, Hosiery Manufacturers & Wholesalers",Apparel,Consumer Goods & Services,14142,Manufacture of women's underwear
Liquid Dietary Supplements,Pharmaceuticals,Pharmaceuticals & Biotechnology,10890,Manufacture of other food products n.e.c.
Liquid Nitrogen Ice Cream Factory,Food & Beverage Industry,Manufacturing & Industrials,10520,Manufacture of ice cream
Liquid Ring Tankers,Logistics & Transportation,Transportation & Logistics,49410,Freight transport by road
Liquid Waste Tankering,Recycling & Waste Management,Manufacturing & Industrials,37000,Sewerage
List Brokers,Sales & Marketing,Marketing & Advertising,82990,Other business support service activities n.e.c.
Literacy Program,Education Services,Education,85590,Other education n.e.c.
Literary Agents,Publishing,"Media, Publishing & Entertainment",74909,"Other professional, scientific and technical activities n.e.c."
Literature Searches,Research & Development Services,Professional Services,74909,"Other professional, scientific and technical activities n.e.c."
Lithographic Plate Makers,Printing Services & Engineering,Manufacturing & Industrials,18130,Pre-press and pre-media services
Live Animals,Agriculture,Agriculture & Farming,01490,Raising of other animals
Live Music,Entertainment Services,"Media, Publishing & Entertainment",90010,Performing arts
Livery Companies,Logistics & Transportation,Transportation & Logistics,49390,Other passenger land transport
Livery Stables,Agriculture,Agriculture & Farming,01430,Raising of horses and other equines
Livestock Farming,Agriculture,Agriculture & Farming,01420,Raising of other cattle and buffaloes
Livestock Markets,Agriculture,Agriculture & Farming,01629,Support activities for animal production (other than farm animal boarding and care) n.e.c.
Livestock Production,Agriculture,Agriculture & Farming,01490,Raising of other animals
Livestock Transportation,Logistics & Transportation,Transportation & Logistics,49410,Freight transport by road
Loans & Debt - Management,Consumer Finance,Financial Services,64929,Other credit granting n.e.c.
Loans/Loan Agencies,Consumer Finance,Financial Services,64929,Other credit granting n.e.c.
Local Government,Public Sector & Government,Public Sector & Government,84110,General public administration activities
Local Ingredients,Food & Beverage Industry,Manufacturing & Industrials,10890,Manufacture of other food products n.e.c.
Local Marketplace,E-commerce,Information Technology,47910,Retail sale via mail order houses or via Internet
Local Nature Conservation,Environmental Engineering & Services,Manufacturing & Industrials,74901,Environmental consulting activities
Location Labels,Printing Services & Engineering,Manufacturing & Industrials,18129,Printing n.e.c.
Locksmith Manufacturers & Suppliers,Manufacturing & Industrials,Manufacturing & Industrials,25720,Manufacture of locks and hinges
Locksmithing/Key Services,Specialized Consumer Services,Consumer Goods & Services,80200,Security systems service activities
Locum Recruitment,Human Resources & Employment Services,Professional Services,78200,Temporary employment agency activities
Lodge,Hospitality Management & Services,Hospitality,55900,Other accommodation
Loft Boarding/Insulation Contractor,Construction Services,Construction & Materials,43999,Other specialised construction activities n.e.c.
Loft Conversion,Construction Services,Construction & Materials,43999,Other specialised construction activities n.e.c.
Loft Ladders,Construction & Engineering,Construction & Materials,43290,Other construction installation
Logistics service,Logistics & Transportation,Transportation & Logistics,52290,Other transportation support activities
"Logs, Firewood & Peat Fuel",Forestry & Logging,Agriculture & Farming,02200,Logging
Lorry Mounted Cranes,Equipment Rental,Manufacturing & Industrials,77320,Renting and leasing of construction and civil engineering machinery and equipment
Lottery,Entertainment Services,"Media, Publishing & Entertainment",92000,Gambling and betting activities
Lottery Retailer,Specialty Retail,Retail,92000,Gambling and betting activities
Low Carbon Fuels,"Oil, Gas & Consumable Fuels",Utilities & Energy,35210,Manufacture of gas
Low Fodmap Food Range,Food & Beverage Industry,Consumer Goods & Services,10890,Manufacture of other food products n.e.c.
Low Income Housing Tax Credits,Property Rental & Real Estate Services,Real Estate,84130,Regulation of and contribution to more efficient operation of businesses
LPG Conversions,Automotive Services,Automotive,45200,Maintenance and repair of motor vehicles
LPG Suppliers,Fuel & Energy,Utilities & Energy,46719,Wholesale of other fuels and related products
Lubricant Manufacturers & Distributors,Chemical Products & Chemicals,Manufacturing & Industrials,19209,Other treatment of petroleum products (excluding petrochemicals manufacture)
Lubricating Equipment,Industrial Equipment & Supplies,Manufacturing & Industrials,28131,Manufacture of pumps
Lubrication Services,Industrial Equipment & Supplies,Manufacturing & Industrials,45200,Maintenance and repair of motor vehicles
Luggage Delivery,Logistics & Transportation,Transportation & Logistics,53201,Licensed carriers
Luxury Fashion,Apparel,Consumer Goods & Services,47710,Retail sale of clothing in specialised stores
Luxury Food,Food Retail,Retail,46380,"Wholesale of other food, including fish, crustaceans and molluscs"
Luxury Gift Hampers,Gifts & Stationery,Retail,47190,Other retail sale in non-specialised stores
Luxury Motor Vehicles,Automobiles,Automotive,45111,Sale of new cars and light motor vehicles
Luxury Retailer Chocolate,Food Retail,Retail,47240,"Retail sale of bread, cakes, flour confectionery and sugar confectionery in specialised stores"
Machine Maintenance,Industrial Equipment & Supplies,Manufacturing & Industrials,33120,Repair of machinery
Machine Shops,Metal Fabrication,Manufacturing & Industrials,25620,Machining
Machine Tools - Manufacturers & Distributors,Industrial Equipment & Supplies,Manufacturing & Industrials,28410,Manufacture of metal forming machinery
Machine Tools Accessories & Services,Industrial Equipment & Supplies,Manufacturing & Industrials,28410,Manufacture of metal forming machinery
Magic Store,Specialty Retail,Retail,47650,Retail sale of games and toys in specialised stores
Magicians Supplies & Equipment,Entertainment Services,"Media, Publishing & Entertainment",46900,Non-specialised wholesale trade
Mail,Mail Services,Transportation & Logistics,53100,Postal activities under universal service obligation
Mail Order & Catalogue Shopping,General Retail & Services,Retail,47910,Retail sale via mail order houses or via Internet
Mailboxes & Address Agents,Mail Services,Transportation & Logistics,82990,Other business support service activities n.e.c.
Mailing Equipment,Industrial Equipment & Supplies,Manufacturing & Industrials,28230,Manufacture of office machinery and equipment (except computers and peripheral equipment)
Mailing Houses/Mailing Services,Mail Services,Transportation & Logistics,82190,"Photocopying, document preparation and other specialised office support activities"
Malt Ingredients For Food,Food & Beverage Industry,Manufacturing & Industrials,10890,Manufacture of other food products n.e.c.
Maintenance of Motor Vehicles,Automotive Services,Automotive,45200,Maintenance and repair of motor vehicles
Makerspace,Education Services,Education,82990,Other business support service activities n.e.c.
Make-Up Artists,Personal Care & Services,Consumer Goods & Services,96020,Hairdressing and other beauty treatment
Make-Up Trailers,Auto Components,Automotive,29202,Manufacture of trailers and semi-trailers
Manufacturer Of Biscuits,Food & Beverage Industry,Manufacturing & Industrials,10720,Manufacture of rusks and biscuits; manufacture of preserved pastry goods and cakes
Mammals,Agriculture,Agriculture & Farming,01490,Raising of other animals
Managed Service,IT Services & Support,Information Technology,62020,Information technology consultancy activities
Management Consulting,Consulting Services,Professional Services,70229,Management consultancy activities other than financial management
Management Services,Business Support Services,Professional Services,70229,Management consultancy activities other than financial management
Manhole Cover Manufacturers & Distributors,Metal Fabrication,Manufacturing & Industrials,25990,Manufacture of other fabricated metal products n.e.c.
Manlift Rental,Equipment Rental,Manufacturing & Industrials,77320,Renting and leasing of construction and civil engineering machinery and equipment
Mansion,Property Rental & Real Estate Services,Real Estate,68209,Other letting and operating of own or leased real estate
Manufacture Of First Automated Pancake Machine,Food Service Equipment,Manufacturing & Industrials,28930,"Manufacture of machinery for food, beverage and tobacco processing"
Manufacturing Sandwiches,Food & Beverage Industry,Manufacturing & Industrials,10850,Manufacture of prepared meals and dishes
Manufacturer Of Prestigious Sports Cars & Luxury Experiences,Automobiles,Automotive,29100,Manufacture of motor vehicles
Manufacturer Of Security Seals Including Plastic,Industrial Equipment & Supplies,Manufacturing & Industrials,22290,Manufacture of other plastic products
Manufacturers & Wholesalers Children & Babywear,Apparel,Consumer Goods & Services,14190,Manufacture of other wearing apparel and accessories n.e.c.
Manufacturers Plastic Products,Plastics Manufacturing,Manufacturing & Industrials,22290,Manufacture of other plastic products
Manufacturers Scientific Apparatus & Instruments,Medical Devices & Services,Healthcare,26511,"Manufacture of electronic measuring, testing etc. equipment, not for industrial process control"
"Manufacturers Wood Products, Except Furniture",Machinery & Manufacturing Services,Manufacturing & Industrials,16290,"Manufacture of other products of wood; manufacture of articles of cork, straw and plaiting materials"
Manufacturing Butchers Blocks,Machinery & Manufacturing Services,Manufacturing & Industrials,31090,Manufacture of other furniture
Milk,Food & Beverage Industry,Manufacturing & Industrials,10511,Liquid milk and cream production
"Maps, Charts & Globes",Books & Media,"Media, Publishing & Entertainment",47610,Retail sale of books in specialised stores
Marble Specialists,Building Materials & Products,Construction & Materials,23700,"Cutting, shaping and finishing of stone"
Marble Supply,Building Materials & Products,Construction & Materials,46730,"Wholesale of wood, construction materials and sanitary equipment"
Marinas & Boat Moorings,Shipping & Marine Transportation,Transportation & Logistics,93290,Other amusement and recreation activities n.e.c.
Marine,Marine Engineering,Transportation & Logistics,52220,Service activities incidental to water transportation
Marine Electrical & Electronic Equipment Manufacturers,Marine Engineering,Manufacturing & Industrials,26301,Manufacture of telegraph and telephone apparatus and equipment
Marine Electrical Services,Marine Engineering,Manufacturing & Industrials,33150,Repair and maintenance of ships and boats
Marine Engineering Equipment Manufacturers,Marine Engineering,Manufacturing & Industrials,33150,Repair and maintenance of ships and boats
Marine Engineers,Marine Engineering,Manufacturing & Industrials,33150,Repair and maintenance of ships and boats
Marine Equipment & Supplies,Marine Engineering,Manufacturing & Industrials,33150,Repair and maintenance of ships and boats
Marine Procurement,Inventory & Supply Chain Management,Professional Services,52220,Service activities incidental to water transportation
Marine Searchlights,Marine Engineering,Manufacturing & Industrials,27400,Manufacture of electric lighting equipment
Marine Services,Marine Engineering,Transportation & Logistics,52220,Service activities incidental to water transportation
Marine Surveyors,Marine Engineering,Transportation & Logistics,80300,Investigation activities
Maritime Solutions,Marine Engineering,Manufacturing & Industrials,33150,Repair and maintenance of ships and boats
Market Gardeners,Agriculture,Agriculture & Farming,01130,"Growing of vegetables and melons, roots and tubers"
Market Growth,Consulting Services,Professional Services,73200,Market research and public opinion polling
Market Operators,Financial Services,Financial Services,82990,Other business support service activities n.e.c.
Market Research,Market Research,Marketing & Advertising,73200,Market research and public opinion polling
Market Stall Builders,Construction & Engineering,Construction & Materials,43999,Other specialised construction activities n.e.c.
Marketing & Advertising,Marketing & Advertising,Marketing & Advertising,73110,Advertising agencies
Marketing Communications,Marketing & Advertising,Marketing & Advertising,70210,Public relations and communications activities
Marketing Consultants & Services,Marketing & Advertising,Marketing & Advertising,70229,Management consultancy activities other than financial management
