sub_industry,Industry,sector,sic_code,sic_description
(HVAC) Heating Contractors & Consultants,Construction & Engineering,Construction & Materials,43220,"Plumbing, heat and air-conditioning installation"
Animal Feed Manufacturing,Agricultural Products,Manufacturing & Industrials,10910,Manufacture of prepared feeds for farm animals
Abortion Advice,Health Care Providers & Services,Healthcare,86900,Other human health activities
Abrasive Products - Manufacturers & Distributors,Materials & Metals,Manufacturing & Industrials,23910,Production of abrasive products
Academy Schools,Education Services,Education,85200,Primary education
Access Consultants,Consulting Services,Professional Services,71129,Other engineering activities
Access Control Systems & Solutions,Security Services & Equipment,Professional Services,80200,Security systems service activities
Access Equipment,Industrial Equipment & Supplies,Manufacturing & Industrials,28220,Manufacture of lifting and handling equipment
Accident Management,Insurance,Financial Services,66210,Risk and damage evaluation
Accommodation Address Agents,Property Rental & Real Estate Services,Real Estate,82990,Other business support service activities n.e.c.
Accounting & Audit,Professional & Commercial Services,Professional Services,69201,Accounting and auditing activities
Accounting & Bookkeeping Services,Professional & Commercial Services,Professional Services,69202,Bookkeeping activities
Accounting Software,Software Development & Services,Information Technology,62012,Business and domestic software development
Acoustical Consultants,Acoustic Engineering,Professional Services,71122,Engineering related scientific and technical consulting activities
Acoustical Engineering,Acoustic Engineering,Professional Services,71129,Other engineering activities
Actuaries,Insurance,Financial Services,66290,Other activities auxiliary to insurance and pension funding
Acupuncture,Health Care Providers & Services,Healthcare,86900,Other human health activities
Addiction Rehabilitation & Treatment Center,Health Care Providers & Services,Healthcare,87200,"Residential care activities for learning difficulties, mental health and substance abuse"
Addictions Helplines,Civic & Social Organizations,Public Sector & Government,86900,Other human health activities
Additive Manufacturing,Machinery & Manufacturing Services,Manufacturing & Industrials,28990,Manufacture of other special-purpose machinery n.e.c.
"Adhesives, Glues & Sealants",Chemical Products & Chemicals,Construction & Materials,20520,Manufacture of glues
Adoption & Fostering,Civic & Social Organizations,Public Sector & Government,88990,Other social work activities without accommodation n.e.c.
Adult Education Centres,Education Services,Education,85590,Other education n.e.c.
Advanced Medics,Health Care Providers & Services,Healthcare,86900,Other human health activities
Advertisement Packages,Marketing & Advertising,Marketing & Advertising,73110,Advertising agencies
Advice,Consulting Services,Professional Services,70229,Management consultancy activities other than financial management
Aerial Photographers,Photography,"Media, Publishing & Entertainment",74202,Other specialist photography
Aeronautical Instrument Makers,Aerospace & Defense,Manufacturing & Industrials,30300,Manufacture of air and spacecraft and related machinery
Aerosols,Chemical Products & Chemicals,Construction & Materials,20590,Manufacture of other chemical products n.e.c.
Aerospace,Aerospace & Defense,Manufacturing & Industrials,30300,Manufacture of air and spacecraft and related machinery
African Restaurants,"Hotels, Restaurants & Leisure",Hospitality,56101,Licenced restaurants
Aftersales Service,Customer Support Services,Professional Services,33190,Repair of other equipment
After-school Care/Activities/Programs,Education Services,Education,85590,Other education n.e.c.
Agricultural Chemical Manufacturing,Chemical Products & Chemicals,Construction & Materials,20150,Manufacture of fertilizers and nitrogen compounds
Agricultural Crops,Agriculture,Agriculture & Farming,01110,"Growing of cereals (except rice), leguminous crops and oil seeds"
Agricultural Engineers,Agricultural Engineering,Agriculture & Farming,71122,Engineering related scientific and technical consulting activities
Agricultural Haulage,Logistics & Transportation,Transportation & Logistics,49410,Freight transport by road
Agricultural Merchants/dealers,Agricultural Equipment,Manufacturing & Industrials,46110,"Agents selling agricultural raw materials, livestock, textile raw materials and semi-finished goods"
Agricultural Services,Agriculture,Agriculture & Farming,01610,Support activities for crop production
Agricultural/Farm Vehicles,Agricultural Equipment,Manufacturing & Industrials,28301,Manufacture of agricultural tractors
Agriculture Buildings,Construction & Engineering,Construction & Materials,41201,Construction of commercial buildings
Agriculture Products,Agriculture,Agriculture & Farming,01610,Support activities for crop production
Agroindustry,Agriculture,Agriculture & Farming,01610,Support activities for crop production
Aid Supplies,Civic & Social Organizations,Public Sector & Government,88990,Other social work activities without accommodation n.e.c.
Air & Ocean Freight Forwarding,Logistics & Transportation,Transportation & Logistics,52290,Other transportation support activities
Air & Ocean Freight Import,Logistics & Transportation,Transportation & Logistics,51210,Freight air transport
Air Charter,Logistics & Transportation,Transportation & Logistics,51102,Non-scheduled passenger air transport
Air Compressors,Industrial Equipment & Supplies,Manufacturing & Industrials,28132,Manufacture of compressors
Air Conditioning & Refrigeration Contractors,Construction & Engineering,Construction & Materials,43220,"Plumbing, heat and air-conditioning installation"
Air Conditioning Equipment & Systems,Mechanical Engineering,Manufacturing & Industrials,28250,Manufacture of non-domestic cooling and ventilation equipment
Air Freight,Logistics & Transportation,Transportation & Logistics,51210,Freight air transport
Air Hygiene,Environmental Engineering & Services,Manufacturing & Industrials,81229,Other building and industrial cleaning activities
Air Pollution Control Systems,Environmental Engineering & Services,Manufacturing & Industrials,28250,Manufacture of non-domestic cooling and ventilation equipment
Air Purification Equipment,Mechanical Engineering,Manufacturing & Industrials,28250,Manufacture of non-domestic cooling and ventilation equipment
Air Tightness Testing And Water Penetration,Building Surveying,Construction & Materials,71200,Technical testing and analysis
Aircraft Charter & Rental Service,Vehicle Rental,Transportation & Logistics,51102,Non-scheduled passenger air transport
Aircraft Services,Aviation,Transportation & Logistics,51102,Non-scheduled passenger air transport
Airline Services,Aviation,Transportation & Logistics,51101,Scheduled passenger air transport
Airline Ticket Agencies,Travel & Leisure,Hospitality,79110,Travel agency activities
Airport Transfers,Logistics & Transportation,Transportation & Logistics,49320,Taxi operation
Airports,Aviation,Transportation & Logistics,52230,Service activities incidental to air transportation
Airway Intubation Management Trainers,Health Care Providers & Services,Healthcare,86900,Other human health activities
Allergy Testing,Health Care Providers & Services,Healthcare,86900,Other human health activities
Alloy Wheels Suppliers,Auto Components,Automotive,45310,Wholesale trade of motor vehicle parts and accessories
Alloys,Materials & Metals,Manufacturing & Industrials,24450,Other non-ferrous metal production
Alternative Farming Systems,Agriculture,Agriculture & Farming,01610,Support activities for crop production
Alternative Fuels,"Oil, Gas & Consumable Fuels",Utilities & Energy,35210,Manufacture of gas
Alternative Medicine Massages,Health Care Providers & Services,Healthcare,86900,Other human health activities
Alternative Retail Outlets,Specialty Retail,Retail,47190,Other retail sale in non-specialised stores
Aluminium Fabricators,Metal Fabrication,Manufacturing & Industrials,25110,Manufacture of metal structures and parts of structures
Aluminium Stockholders,Materials & Metals,Construction & Materials,46720,Wholesale of metals and metal ores
Ambient Storage Service,Warehousing,Transportation & Logistics,52103,Operation of warehousing and storage facilities for land transport activities
Ambulance Services,Health Care Providers & Services,Healthcare,86900,Other human health activities
American Restaurants,"Hotels, Restaurants & Leisure",Hospitality,56101,Licenced restaurants
Amusement Machine Manufacturers,Machinery & Manufacturing Services,Manufacturing & Industrials,32409,"Manufacture of other games and toys, n.e.c."
Anaerobic Digestion,Renewable Energy,Utilities & Energy,38210,Treatment and disposal of non-hazardous waste
Analytical & Consulting Pharmacist,Pharmaceuticals,Pharmaceuticals & Biotechnology,74909,"Other professional, scientific and technical activities n.e.c."
Angling & Sports Fishing,Travel & Leisure,Hospitality,93199,Other sports activities
Animal and Bird Enclosures,Travel & Leisure,Hospitality,93290,Other amusement and recreation activities n.e.c.
Animal By-products,Agriculture,Agriculture & Farming,10110,Processing and preserving of meat
Animal Care,Veterinary Services & Supplies,Healthcare,75000,Veterinary activities
Animal Carrier Services,Logistics & Transportation,Transportation & Logistics,49410,Freight transport by road
Animal Encounters,Travel & Leisure,Hospitality,93290,Other amusement and recreation activities n.e.c.
Animal Equipment,Veterinary Services & Supplies,Healthcare,32990,Other manufacturing n.e.c.
Animal Farming,Agriculture,Agriculture & Farming,01490,Raising of other animals
Animal Feed,Agriculture,Agriculture & Farming,10910,Manufacture of prepared feeds for farm animals
Feed Manufacturing,Agricultural Products,Manufacturing & Industrials,10910,Manufacture of prepared feeds for farm animals
Animal Health,Veterinary Services & Supplies,Healthcare,75000,Veterinary activities
Animal Oncology & Rehabilitation,Veterinary Services & Supplies,Healthcare,75000,Veterinary activities
Animal Rescue & Animal Welfare,Civic & Social Organizations,Public Sector & Government,96090,Other service activities n.e.c.
Animal Rights,Civic & Social Organizations,Public Sector & Government,94990,Activities of other membership organisations n.e.c.
Animal Sales,Agriculture,Agriculture & Farming,46230,Wholesale of live animals
Animal Shelter,Civic & Social Organizations,Public Sector & Government,75000,Veterinary activities
Animal Sport Medication & Doping Control,Veterinary Services & Supplies,Healthcare,75000,Veterinary activities
Animal Training,Pet Services & Supplies,Consumer Goods & Services,96090,Other service activities n.e.c.
Animals Hydrotherapy,Veterinary Services & Supplies,Healthcare,75000,Veterinary activities
Animation,Media Production & Services,"Media, Publishing & Entertainment",59111,Motion picture production activities
Animation Media,Media Production & Services,"Media, Publishing & Entertainment",59112,Video production activities
Animation Software & Services,Software Development & Services,Information Technology,62090,Other information technology service activities
Anodisers,Metal Fabrication,Manufacturing & Industrials,25610,Treatment and coating of metals
Antique & Vintage Furniture,Furniture,Retail,47599,"Retail of furniture, lighting, and similar (not musical instruments or scores) in specialised store"
Antique Dealers,Specialty Retail,Retail,47791,Retail sale of antiques including antique books in stores
Antique Furniture Restoration/Repair Services,Specialized Consumer Services,Consumer Goods & Services,95240,Repair of furniture and home furnishings
Apartment Letting Agency,Property Rental & Real Estate Services,Real Estate,68209,Other letting and operating of own or leased real estate
App Development,Software Development & Services,Information Technology,62012,Business and domestic software development
Apparel,Apparel,Consumer Goods & Services,14190,Manufacture of other wearing apparel and accessories n.e.c.
Apparel & Fashion,Apparel,Consumer Goods & Services,46420,Wholesale of clothing and footwear
Appliance Repair Services,Specialized Consumer Services,Consumer Goods & Services,95220,Repair of household appliances and home and garden equipment
Apprenticeship Center,Education Services,Education,85410,Post-secondary non-tertiary education
Apps,Software Development & Services,Information Technology,62090,Other information technology service activities
Aquaculture,Aquaculture,Agriculture & Farming,03220,Freshwater aquaculture
Aquarium & Vivarium Tank & Accessory Manufacturers,Pet Services & Supplies,Consumer Goods & Services,32990,Other manufacturing n.e.c.
Aquariums - Public,Travel & Leisure,Hospitality,91040,Botanical and zoological gardens and nature reserves activities
Aquatic Equipment And Accessories Store,Pet Services & Supplies,Retail,47760,"Retail sale of flowers, plants, seeds, fertilizers, pet animals and pet food in specialised stores"
Arbitrators,Legal Services,Professional Services,69109,Activities of patent and copyright agents; other legal activities n.e.c.
Arboriculture,Forestry & Logging,Agriculture & Farming,02100,Silviculture and other forestry activities
Arcade Games Amusement,Entertainment Services,"Media, Publishing & Entertainment",93210,Activities of amusement parks and theme parks
Archaeology,Professional & Commercial Services,Professional Services,72200,Research and experimental development on social sciences and humanities
Architects,Architectural Engineering,Construction & Materials,71111,Architectural activities
Architectural and Structural Metal Manufacturing,Metal Fabrication,Manufacturing & Industrials,25110,Manufacture of metal structures and parts of structures
Architectural Design,Architectural Services,Construction & Materials,71111,Architectural activities
Architectural Engineering,Engineering Services,Professional Services,71111,Architectural activities
Architectural Ironmongers,Metal Fabrication,Manufacturing & Industrials,25990,Manufacture of other fabricated metal products n.e.c.
Architectural Salvage,Building Materials & Products,Retail,46770,Wholesale of waste and scrap
Architectural Services,Architectural Services,Construction & Materials,71111,Architectural activities
Architectural Technologists,Architectural Services,Construction & Materials,71111,Architectural activities
Architectural Woodwork,Machinery & Manufacturing Services,Manufacturing & Industrials,16230,Manufacture of other builders' carpentry and joinery
Archivists,Records Management,Professional Services,91012,Archives activities
Argentinian Restaurants,"Hotels, Restaurants & Leisure",Hospitality,56101,Licenced restaurants
Army Surplus Stores,Specialty Retail,Retail,47789,Other retail sale of new goods in specialised stores (not commercial art galleries and opticians)
Aromatherapy,Health Care Providers & Services,Healthcare,86900,Other human health activities
Art & Craft Materials,Art & Craft,"Media, Publishing & Entertainment",47599,"Retail of furniture, lighting, and similar (not musical instruments or scores) in specialised store"
Art Galleries & Fine Art Dealers,Art & Craft,"Media, Publishing & Entertainment",47781,Retail sale in commercial art galleries
Art Of Hosting,Hospitality Management & Services,Hospitality,82302,Activities of conference organisers
Art Print & Digital Font,Art & Craft,"Media, Publishing & Entertainment",18129,Printing n.e.c.
Art Restoration & Picture Cleaning,Art & Craft,Consumer Goods & Services,90030,Artistic creation
Art Supplies,Art & Craft,"Media, Publishing & Entertainment",47781,Retail sale in commercial art galleries
Articulated Vehicles,Automobiles,Automotive,29100,Manufacture of motor vehicles
Artificial Grass Suppliers,Garden Supplies,Retail,81300,Landscape service activities
Artificial Intelligence,AI Development,Information Technology,62012,Business and domestic software development
Beer Tank Solutions,Beverage Distribution,Manufacturing & Industrials,28930,"Manufacture of machinery for food, beverage and tobacco processing"
Artists & Illustrators,Art & Craft,"Media, Publishing & Entertainment",90030,Artistic creation
Arts & Crafts,Art & Craft,"Media, Publishing & Entertainment",90030,Artistic creation
Arts & Culture,Arts & Entertainment,"Media, Publishing & Entertainment",90010,Performing arts
Arts & Entertainment,Arts & Entertainment,"Media, Publishing & Entertainment",90010,Performing arts
Arts Centre,Arts & Entertainment,"Media, Publishing & Entertainment",90040,Operation of arts facilities
Artwork,Art & Craft,"Media, Publishing & Entertainment",90030,Artistic creation
Asbestos Air Monitoring,Environmental Engineering & Services,Manufacturing & Industrials,74901,Environmental consulting activities
Asbestos Awareness Training,Education Services,Education,85590,Other education n.e.c.
Asbestos Risk Management,Environmental Engineering & Services,Manufacturing & Industrials,74901,Environmental consulting activities
Asbestos Surveys & Removal,Environmental Engineering & Services,Manufacturing & Industrials,43999,Other specialised construction activities n.e.c.
Asbestos Surveys Management,Environmental Engineering & Services,Manufacturing & Industrials,74901,Environmental consulting activities
Asphalt And Macadam Suppliers,Building Materials & Products,Manufacturing & Industrials,23990,Manufacture of other non-metallic mineral products n.e.c.
Athlete,Travel & Leisure,Hospitality,93120,Activities of sport clubs
ATMs,Banks,Financial Services,82990,Other business support service activities n.e.c.
Attic & Roof Insulation Contractors,Construction Services,Construction & Materials,43290,Other construction installation
Attractions,Travel & Leisure,Hospitality,93210,Activities of amusement parks and theme parks
ATV (all Terrain Motorcycle) Quad Bike,Automobiles,Automotive,30910,Manufacture of motorcycles
Auctioneers & Valuers,Valuation Services,Professional Services,82990,Other business support service activities n.e.c.
Audio and Video Equipment Manufacturing,Household Goods & Services,Manufacturing & Industrials,26400,Manufacture of consumer electronics
Audio Visual Equipment & Accessories Supplies,Electronics Retail,Retail,46431,"Wholesale of audio tapes, records, CDs and video tapes and the equipment on which these are played"
Audio Visual Production Services,Media Production & Services,"Media, Publishing & Entertainment",59120,"Motion picture, video and television programme post-production activities"
Auto Electricians/Auto Electrical Services,Automotive Services,Consumer Goods & Services,45200,Maintenance and repair of motor vehicles
Auto Insurance Agency,Insurance,Financial Services,66210,Risk and damage evaluation
Auto Locksmiths,Automotive Services,Consumer Goods & Services,95290,Repair of personal and household goods n.e.c.
Auto Parts & Supplies,Auto Components,Automotive,45320,Retail trade of motor vehicle parts and accessories
Autogas Suppliers & Installers,"Oil, Gas & Consumable Fuels",Utilities & Energy,45310,Wholesale trade of motor vehicle parts and accessories
Automated Storage & Retrieval Systems,Industrial Equipment & Supplies,Manufacturing & Industrials,33200,Installation of industrial machinery and equipment
Automatic Gate System Manufacturers,Security Services & Equipment,Manufacturing & Industrials,25110,Manufacture of metal structures and parts of structures
Automation,Industrial Equipment & Supplies,Manufacturing & Industrials,33200,Installation of industrial machinery and equipment
Automation Systems & Equipment,Industrial Equipment & Supplies,Manufacturing & Industrials,33200,Installation of industrial machinery and equipment
Automobile,Automobiles,Automotive,29100,Manufacture of motor vehicles
Automobile Engine Parts & Component Manufacturers,Auto Components,Automotive,29320,Manufacture of other parts and accessories for motor vehicles
Automotive,Automobiles,Automotive,29100,Manufacture of motor vehicles
Automotive & Motor Retail,Automobiles,Automotive,45111,Sale of new cars and light motor vehicles
Automotive Components,Auto Components,Automotive,29320,Manufacture of other parts and accessories for motor vehicles
Automotive Repair Centre or Shop,Automotive Services,Consumer Goods & Services,45200,Maintenance and repair of motor vehicles
Aviation,Aviation,Transportation & Logistics,51102,Non-scheduled passenger air transport
Aviation and Aerospace Component Manufacturing,Aerospace & Defense,Manufacturing & Industrials,30300,Manufacture of air and spacecraft and related machinery
Aviation Engineers,Aerospace Engineering,Manufacturing & Industrials,30300,Manufacture of air and spacecraft and related machinery
Aviation Security,Security Services & Equipment,Professional Services,80100,Private security activities
Aviation Supplies,Aviation,Transportation & Logistics,46690,Wholesale of other machinery and equipment
Axle Supplies & Services,Auto Components,Automotive,29320,Manufacture of other parts and accessories for motor vehicles
B2B,Business Services,Professional Services,82990,Other business support service activities n.e.c.
B2C,E-commerce,Information Technology,47910,Retail sale via mail order houses or via Internet
Baby & Nursery Equipment,Specialty Retail,Retail,47789,Other retail sale of new goods in specialised stores (not commercial art galleries and opticians)
Baby Clothing,Apparel,Consumer Goods & Services,46420,Wholesale of clothing and footwear
Bottled Water Coolers,Beverage Distribution,Manufacturing & Industrials,28290,Manufacture of other general-purpose machinery n.e.c.
Baby Shower Services,Events Management,Professional Services,96090,Other service activities n.e.c.
Baby Sitters,Specialized Consumer Services,Consumer Goods & Services,96090,Other service activities n.e.c.
Bacon & Ham Curers & Merchants/Dealers,Food & Beverage Industry,Consumer Goods & Services,10130,Production of meat and poultry meat products
Badges & Emblems,Gifts & Stationery,Consumer Goods & Services,32990,Other manufacturing n.e.c.
Bagels,"Hotels, Restaurants & Leisure",Hospitality,10710,Manufacture of bread; manufacture of fresh pastry goods and cakes
"Bags, Belts & Accessories - Manufacturers",Apparel,Manufacturing & Industrials,14110,Manufacture of leather clothes
Bailiffs,Legal Services,Professional Services,82911,Activities of collection agencies
Drinking Water Coolers,Beverage Distribution,Manufacturing & Industrials,28290,Manufacture of other general-purpose machinery n.e.c.
Bakery & Confectionery Supplies,Food & Beverage Industry,Consumer Goods & Services,46360,Wholesale of sugar and chocolate and sugar confectionery
Baking Training,Education Services,Education,85590,Other education n.e.c.
Ballet/Dance Schools,Education Services,Education,85520,Cultural education
Balloons - Hot Air,Travel & Leisure,Hospitality,51102,Non-scheduled passenger air transport
Bankruptcy,Legal Services,Professional Services,82911,Activities of collection agencies
Banks & Financial Institutions,Banks,Financial Services,64191,Banks
Bar Code Products & Services,Information Technology (IT),Information Technology,62090,Other information technology service activities
Bar Design,Interior Design,Professional Services,71111,Architectural activities
Bar Equipment & Accessories,Industrial Equipment & Supplies,Manufacturing & Industrials,28930,"Manufacture of machinery for food, beverage and tobacco processing"
Bar Fitters,Construction & Engineering,Construction & Materials,43320,Joinery installation
Bar Operations,"Pubs, Bars & Inns",Hospitality,56302,Public houses and bars
Barge Charter,Shipping & Marine Transportation,Transportation & Logistics,50200,Sea and coastal freight water transport
Barrel Supplier,Packaging & Paper Products,Manufacturing & Industrials,25910,Manufacture of steel drums and similar containers
Barristers,Legal Services,Professional Services,69101,Barristers at law
Bars,"Pubs, Bars & Inns",Hospitality,56302,Public houses and bars
Base Operations Support,Aerospace & Defense,Manufacturing & Industrials,52230,Service activities incidental to air transportation
Basement & Cellar Conversions,Construction & Engineering,Construction & Materials,43290,Other construction installation
"Bathroom Design, Installation & Supply",Construction & Engineering,Construction & Materials,43290,Other construction installation
Bathroom Equipment & Fittings,Home Goods,Retail,46740,"Wholesale of hardware, plumbing and heating equipment and supplies"
Bathroom Fixtures - Manufacturers,Household Goods & Services,Manufacturing & Industrials,23420,Manufacture of ceramic sanitary fixtures
Bathroom Planners & Furnishers,Furniture,Retail,47599,"Retail of furniture, lighting, and similar (not musical instruments or scores) in specialised store"
"Battery Cell, Batteries Manufacturer & Suppliers",Energy & Utilities Brokerage Services,Manufacturing & Industrials,27200,Manufacture of batteries and accumulators
BBQ Equipment & Supplies,Garden Supplies,Retail,47520,"Retail sale of hardware, paints and glass in specialised stores"
Beads & Bead,Art & Craft,"Media, Publishing & Entertainment",32120,Manufacture of jewellery and related articles
Beard Care Products,Personal Care & Services,Retail,20420,Manufacture of perfumes and toilet preparations
Bearing Manufacturers,Machinery & Manufacturing Services,Manufacturing & Industrials,28150,"Manufacture of bearings, gears, gearing and driving elements"
Bearings Stockists,Industrial Equipment & Supplies,Manufacturing & Industrials,46690,Wholesale of other machinery and equipment
Beauty & Spas,Personal Care & Services,Consumer Goods & Services,96020,Hairdressing and other beauty treatment
Beauty Consultants & Specialists,Personal Care & Services,Consumer Goods & Services,96020,Hairdressing and other beauty treatment
